Name;Description
EMBIRA DE SAPO ( Lonchocarpus cultratus.);Conhecida como falso-timbó, guaianã, ingá-bravo, embira-de-carrapato, pau-de-carrapato, rabo-de-macaco, pau-de-canzil, e maracanã-da-grande, essa árvore apresenta características ornamentais, sobretudo em função de sua copa piramidal. É comum ser empregada na arborização urbana. Atinge 3,5 metros em 2 anos. É indicada também para ser plantada em áreas degradadas de preservação permanente e se adapta bem à terrenos pobres e secos.A madeira, dura, pesada e compacta, costuma servir para obras internas da construção civil e peças torneadas.
ERVA CIDREIRA (Lippia alba);
ERVA DOCE (Pimpinella anisum L.);
ERVA MATE (Aquifoliaceae);É considerada árvore símbolo do Rio Grande do Sul. Também é parte integrante dos símbolos do Estado do Paraná, estando representada, com um ramo da planta, na bandeira e no brasão estadual. Pode atingir doze metros de altura. Tem caule cinza, folhas ovais e fruto pequeno e verde ou vermelho-arroxeado.
ERVILHA TORTA DE FLOR ROXA (Pisum sativum.);Sementes de Ervilha Torta, da variedade de Flor Roxa, da espécie Pisum sativum, uma planta trepadeira, que produz vagens tenras e deliciosas, de cor verde clara com comprimento entre 13 e 15 cm e diâmetro entre 2,5 e 3,5 cm. Ideal para o preparo de refogados.
ESPADA DE SÃO JORGE (Sansevieria Trifasciata);
ESPATÓDEA ( Spathodea.);Spathodea campanulata, conhecida por mijinho, mijadeira, bisnagueira, tulipeira-do-gabão ou chama-da-floresta é uma árvore da família das Bignoniaceae, sendo a única espécie do seu género botânico. O nome genérico deriva da palavra grega spathe, relativa ao cálice em formato de espádice.
ESPINAFRE NOVA ZELANDIA (Tetragonia tetragonoides.);O Espinafre-da-nova-zelândia é uma planta rasteira de textura semi-herbácea, muito cultivada para consumo como verdura. É a espécie de espinafre mais consumida no Brasil, o que causa muita confusão com o espinafre-verdadeiro, da espécie Spinacia oleracea, mais consumida nos Estados Unidos e Europa.
ESPIRRADEIRA (Nerium oleander);
Name;Description
ESTRAGAO RUSSO ARTEMISIA (Artemisia camphorata);É uma planta que não deve faltar na horta doméstica, pois mesmo com pouco uso, é uma excelente planta companheira, repelindo insetos e outras pragas. Por este motivo é também interessante plantá-lo nos canteiros do jardim. Seu formato arredondado, textura e cor são excelentes para formar planos de fundo e enaltecer floríferas por exemplo.
ESTRELA DO MAR ( Haworthia cymbidormis);Suculenta recheada de água, a Estrela do Mar possui folhas macias e coloração verde semi-translúcido, sendo suas flores pequenas, brancas e em forma de sino em hastes longas
EUCALIPTO ARCO-IRIS (Eucalyptus deglupta);
EUGÊNIA (Eugenia sprengelli);
FALSO BARBATIMAO (Cassia leptophylla.);O Falso-Barbatimão é uma árvore da família das fabáceas, sub-família Caesalpinioideae. É característica de formações secundárias de florestas e sua ocorrência no interior da mata primária densa é rara. A frutificação ocorre no inicio no mês de março e tem seu término ao final julho Esta árvore tem origem no Brasil.
FARINHA SECA ( Peltophorum dubium);O conjunto elegante formado pela copa, ramagem e tronco da Farinha-Seca a tornam uma árvore bastante decorativa, ideal para grandes espaços, como parques e jardins amplos. Quando florida é um espetáculo à parte e torna-se muito atrativa para abelhas e outros insetos polinizadores. Ameaçada de extinção, esta árvore nativa também é considerada pioneira e de sucessão primária, sendo importante incluí-la em programas de reflorestamento e recuperação ambiental.
FAVA ARARA ( Parkia multijuga Benth.);"A madeira é empregada apenas para compensados, caixotaria, brinquedos, etc. A árvore é ornamental, principalmente pela folhagem brilhante e porte elegante; pode ser empregada com sucesso no paisagismo, principalmente na arborização de grandes avenidas e praças públicas. Planta de rápido crescimento, ótima para plantios de áreas degradadas visando a recomposição de sua vegetação."
FEDEGOSO (Senna macranthera);
FEDEGOSO (Senna occidentalis);Planta invasora de culturas anuais, perenes, pomares e especialmente pastagens. Tolera solos pobres, erodidos e secos. É tóxica para bovinos, ovinos, equinos e aves.
FIGO NEGRITO (PRETO PEQUENO, FICUS CARICA);
FIGO-DA-ÍNDIA (Opuntia ficus indica);
FIGUEIRA BRANCA (Ficus guaranitica.);A árvore é frondosa, proporcionando ótima sombra, por isso normalmente é utilizada para arborização rural e eventualmente para paisagismo de praças e jardins. É também indicada para a composição de reflorestamentos destinados à recomposição de áreas degradadas de preservação permanente.
FISÁLIS (Physalis angulata);A Physalis é uma fruta comestível da família das solanáceas, a mesma do tomate, da beringela, da batata e do pimentão. Ela também é conhecida como camapum, saco-de-bode, mulaca, joá e joá-de-capote. Pequena, redonda e de cor verde, amarela, laranja ou vermelha, nasce em arbusto de caule ereto e ramificado - que pode atingir até 2,5 metros de altura quando tutorado. Em seu desenvolvimento, a physalis fica dentro de um casulo feito de folha fina e em formato de cálice.
FISALIS (Physalis);
FLAMBOYANT (Delonix regia);
FLAMBOYANT VERMELHO ( Delonix regia);Considerado uma das árvores mais belas do mundo, de copa abundante e irregular que costuma exibir suas exuberantes flores de forma vigorosa na época do verão.
FLAMBOYANZINHO (Caesalpinia pulcherrima);Arbusto muito popular no paisagismo tropical. Suas flores são maravilhosas e exuberantes formando belo aspecto paisagístico.
FLOR-DE-SINO (Abutilon pictum);
FORMIO ROXO (Phormium tenax rubrum);
FORMIO VARIEGATA (Phormium tenax Variegata);
Name;Description
FORMIO VERDE (Phormium tenax);
FRAMBOESA (Rubus idaeus);
FRUTA DO CONDE (Rollinia silvatica);
FRUTA PÃO (Artocarpus altilis);
Frutíferas ;De forma detalhada, o livro ensina qual é o local ideal, as mudas mais indicadas e os substratos que devem ser usados na hora de se montar um pomar, além de contar com projetos de paisagismo.
Frutíferas para passarinhos ;
FUNCHO DE CABEÇA ERVA DOCE (Pimpinella anisum L.);O sabor aromático do Funcho é único, relembrando mesmo o licor de anis, tanto que é muitas vezes, e erradamente, referido como anis em muitos mercados. A textura do funcho é similar à do aipo, ou seja crocante e ligeiramente estriada. O nome científico do funcho é Foeniculum Vulgare.
Gabiroba 	(Campomanesia xanthocarpa);
GARAPEIRA ( Apuleia Ieiocarpa.);"A Garapeira quando cresce isoladamente adquire copa frondosa e pode ser usada no paisagismo em geral.A madeira de garapa, por ser pesada, de durabilidade natural moderada, de resistência mecânica entre média e alta, é indicada para construção de estruturas externas, dormentes, postes estacas, mourões, carrocerias; em construção civil, como vigas, caibras, ripas, tábuas e tacos para assoalhos; marcos de portas e janelas etc.; barris de cerveja, cabos de ferramentas; construções navais, como estruturas, quilhas etc."
GARDÊNIA  (Gardenia jasminoides);
Gel para Plantio - pcte com 3g;
GIRASSOL OUTONO BONITO SORTIDO (Helianthus annuus.);"Sementes de Girassol, da variedade ""Bonito de Outono"", uma planta espetacular pela sua beleza. Como o próprio nome diz, as inflorescências do girassol realizam heliotropismo, isto é, seguem o sol. Os girassóis desta cultivar alcançam de 2 a 2,5 metros de altura. Produz cerca de 10 hastes/planta e flores com 10 a 15 cm de diâmetro. Suas folhas são pilosas, o que lhe confere uma coloração acinzentada. As inflorescências do tipo capítulo podem ser amarelas ou vermelhas."
GIZ AZUL (Senecio serpens);Conhecido como Giz Azul e originário da África do Sul, esta simpática suculenta possui folhas cor verde-azulada, carnosas, lineares e cilíndricas. São perenes e florescem no verão.
GOIABA (Psidium guajava);
GOIABA BRANCA ( Psidium guajava);A Goiaba Branca é uma planta perene podendo dar frutos o ano todo. A goiaba é doce, de perfume marcante e costuma surgir no outono. Muito usada na produção de bebidas e produtos artesanais e é muito delicada para transporte. Seus frutos são de coloração amarelada em seu interior.
GOIABA VERMELHA (Psidium guajava);A Goiaba Branca é uma planta perene podendo dar frutos o ano todo. A goiaba é doce, de perfume marcante e costuma surgir no outono. Muito usada na produção de bebidas e produtos artesanais e é muito delicada para transporte. Seus frutos são de coloração avermelhada em seu interior.
GONFRENAPERPETUA GLOBOSA SORTIDA ( Gomphrena globosa ) Sob encomenda;Sementes de perpétua, também conhecida como Amaranthus globular. Ela é uma planta herbácea de flores de coloração roxa, rósea ou branca. Suas folhas são oval-lanceoladas, de textura pilosa e coloração verde-clara.
GRAMA AZUL ( Festuca glauca) Sob encomenda;A combinação da coloração azulada com a textura fina e elegante desta gramínea, tornam-a muito requisitada em projetos paisagísticos. Ela é apropriada para forrações e para formação de maciços e bordaduras. Utilize estes bonitos pompons para criar contrastes com o piso e outras plantas de cores diferentes no jardim.
GRAMA BERMUDA FOLHA FINA ( Cynodondactylon.);A Grama Bermuda é ideal para campos de futebol pelo fato de se regenerar rapidamente além de possuir uma textura alcolchoada densa e macia, de cor verde vivo. Nos gramados ela deve ser sempre bem aparada, irrigada e fertilizada. Pode ser também recomendada para gramados, campos de golfe, playgrounds ou pastagens.
GRAMA SÃO CARLOS JESUITA FOLHA LARGA (Axonopus Compressus SP.) Sob encomenda;A Grama São Carlos tem folhas largas, lisas e sem pêlos. É estolonífera, isto é, o caule fica acima do solo e emite as raízes para baixo e as folhas para cima. De coloração verde vibrante a pleno sol e um pouco mais escura à sombra, há ainda uma forma variegada de folhas com margens branco-creme. É indicada para jardins públicos, industriais, residenciais, principalmente sítios e fazendas.
Name;Description
GRAVIOLA ( Annona muricata);A Graviola é uma bela árvore que gera frutos de sabor marcante. De origem tropical, ganhou a atenção dos Brasileiros.
GRAVIOLA (Annona muricata);
GRUMIXAMA (Eugenia brasiliensis);
GUACO (Mikania glomerata Spreng.);
GUAIMBÉ (Philodendron bipinnatifidum);
GUANANDI ( Calophyllum brasiliensis);O Guanandi ou Jacareúba (Calophyllum brasiliense Cambess.) é uma árvore brasileira que atinge 20 a 30 metros com diâmetro de 40 a 60 cm. Possui tronco que segrega látex amarelo e pegajoso, que demora a sair.
GUANANDI (Calophyllum brasiliensis);
GUAPURUVU ( Schizolobium parahyba.);O Guapuruvu é uma árvore de crescimento impressionante. Ela é apropriada para jardins extensos, assim como parques e praças, modificando em poucos anos a paisagem. Além do aspecto escultural de seu caule e copa, esta bela árvore ainda nos presenteia com uma floração espetacular. Sua madeira é clara, leve e macia, prestando-se para a caixotaria, artesanato, construção civil e fabricação de canoas.
GUARANÁ (Paullinia cupana);
GUARANTÃ (Esenbechia leiocarpa);
GUARITÁ (Astronium graveolens);
GUATAMBU (Aspidosperma macrocarpon. );A árvore Guatambú é encontrada no Brasil do sul da Bahia até o Rio Grande do Sul, estando presente também nos estados de Minas Gerais, Goiás, Mato Grosso do Sul, São Paulo, Paraná, Santa Catarina e Rio Grande do Sul. É fácilmente vista na Serra da Cantareira e restante da Mata Atlântica.
Guia de Plantas Para Uso Paisagístico: Jardim à Sombra e vertical ;Guia ideal para acertar de vez no paisagismo ideal à sombra e Jardim vertical. 120 espécies para você conhecer e adequar ao seu ambiente.
Guia de Plantas Para Uso Paisagístico: Trepadeiras & Esculturais 2;Uma seleção de 120 espécies facilmente encontradas no Brasil para você valorizar o seu jardim. Descubra as que vão melhor na sua região e escolha as mais adequadas para garantir o sucesso do seu paisagismo.
GUINÉ (Petiveria tetrandra);
HELICÔNIA ROSTRATA (Heliconia rostrata);
HIBISCUS (Hibiscus rosa-sinensis);
HORTELÃ (Mentha sp);
HORTELÃ PIMENTA(Mentha sp);
HORTÊNCIA (Hydrangea macrophylla);
Name;Description
Introdução a Botânica Morfologia;Este livro tem por objetivo o estudo dos termos utilizados para as partes das plantas, suas variações, origens e relações com o meio ambiente, além de aspectos ligados à evolução dos vegetais.
IPÊ AMARELO (Handroanthus albus);
IPÊ AMARELO DA CASCA LISA ( Tabebuia chrysotricha);Famoso pela coloração das flores produz belíssimo efeito tanto na copa da árvore como no chão das ruas, o Ipê Amarelo de casca lisa forma um tapete de flores contrastantes com o cinza do asfalto.
IPÊ AMARELO DOURADO/CASCUDO (Handroanthus chrysotrichus);Ipê Amarelo, árvore frondosa de floração magnífica, também conhecido como  pau-darco-amarelo, ipê-do-morro, ipê-tabaco, ipê-amarelo-cascudo, ipê-açu e aipe. O Ipê Amarelo é uma árvore caducifólia, isso significa que em determinada estação do ano todas as folhas caem dando lugar a uma espetacular florada. Uma característica importante do Ipê e que ele atrai abelhas e pássaros, principalmente o beija-flor, agentes fundamentais na polinização da flora.
IPÊ BRANCO ( Tabebuia roseo-alba);O Ipê-Branco é uma árvore de grande valor ornamental, que valoriza projetos paisagísticos tanto pelo seu florescimento vistoso, quanto pela sua forma elegante e copa azulada. Por seu caduca durante o inverno, é boa para produzir sombra no verão e permitir maior passagem da luz e calor do sol no inverno.
IPÊ BRANCO (Tabebuia roseo-alba);
IPÊ CAROBA VERDE ( Cybistax antisyphilitica);O nome Ipê, vem do Tupi, “na água” madeira flutuante usada na construção naval.  Antisyphilitica significa  uso no combate à sífilis. Árvore decídua heliófita, xerófita e seletiva, espécie pioneira, espécie de rara ocorrência, com propriedades medicinais. Sua altura atinge  até 18 m e seu diâmetro até 40 cm.
IPÊ FELPUDO ( Zeyheria tuberculosa);O Ipê-Felpudo, também conhecido por Ipê-Tabaco, bolsa-de-pastor, camaruçu, bucho-de-boi, ipê-bóia, ipê-cabeludo, ipê-cumbuca, ipê-preto, ipê-una, velame-do-mato e saco-de-carneiro, é uma espécie de planta da família Bignoniaceae. É chamado de Ipê, mas não faz parte do gênero Tabebuia.
IPÊ MIRIN ( Bignoniaceae);O Ipê-de-jardim é uma arvoreta bastante ramificada, que pode alcançar 4 a 6 metros de altura. No paisagismo é apropriada isolada ou em grupos, formando renques. No entanto sua utilização é controversa, pois apesar de ser muito ornamental é considerada uma perigosa planta invasora.
IPÊ ROSA ( Tabebuia impetiginosa);O Ipê sempre ganha destaque entre as demais plantas... O Ipê Rosa é o primeiro dos Ipês a florescer no Brasil.
IPÊ ROSA (Handroanthus heptaphyllus);
IPÊ ROXO BOLA (Tabebuia impetiginosa) Sob encomenda;Além da beleza de suas flores, que chamam a atenção em qualquer paisagem (inclusive nas grandes cidades), sua madeira, dura ao corte e pesada, é usada para a construção externa (dormentes, cruzetas, postes, etc) e na produção de carvão. O Ipê Roxo de Bola tem ainda aplicações medicinais e na recomposição vegetal de áreas degradadas de preservação permanente.
IPÊ ROXO DE BOLA (Handroanthus impetiginosus);
IPOMÉIA RUBRA (Ipomoea horsfalliae);
IXÓRIA COMUM ROSA(Ixoria Undulata);
JABUTICABA BRANCA (Myrciaria aureana);
JABUTICABA HIBRIDA (Myrciaria cauliflora);
JABUTICABA SABARÁ (Myrciaria jaboticaba);
JACA (Artocarpus heterophyllus);
Jaca Dura (Artocarpus heterophyllus);
Name;Description
JACARANDA BRANCO ( Jacaranda cuspidifolia.);A madeira do Jacarandá Branco foi muito utilizada na confecção de canga de boi, para objetos curvados, barricas, pecas torneadas, etc. A árvore pode ser aproveitada para arborização em geral. Planta pioneira, rústica e adaptada a terrenos pobres, é ótima para a composição de reflorestamentos heterogêneos destinados à recomposição de áreas degradadas de preservação permanente.
Jacarandá Caroba (Jacaranda cuspidifolia);
JACARANDÁ DA BAHIA ( Dalbergia nigra);O Jacarandá da Bahia é uma das mais lindas árvores brasileiras, magnífica, e amplamente introduzida em muitos países de clima tropical e sub-tropical.
JACARANDÁ DA BAHIA (Dalbergia nigra);
JACARANDÁ MIMOSO ( Jacaranda mimosifolia);O Jacarandá-Mimoso é uma árvore ornamental da família Bignoniaceae, nativo da Argentina, Bolívia e Sul do Brasil que se encontra ameaçada em seu habitat natural. É uma das poucas árvores a ter o mesmo nome comum em quase todos os idiomas do mundo. No inverno, o jacarandá-mimoso perde suas folhas, que dão lugar as flores na primavera. Suas flores são duráveis, perfumadas e grandes, de coloração azul ou arroxeada, em forma de trompete e são arranjadas em inflorescências do tipo panícula.
JACARANDÁ MIMOSO (Jacaranda mimosifolia);
JACARANDÁ PAULISTA ( Machaerium vilossum.);O Jacarandá-Paulistana, jacarandá-do-mato, jacarandá-do-cerrado, jacarandá-pardo ou jacarandá-amarelo, é uma árvore encontrada principalmente nos estados de Minas Gerais, Goiás e São Paulo. Esta árvore fornece madeira de lei muito semelhante à do jacarandá-da-bahia.
JACATIA ( Jacaratia spinosa);O Jacatia possui a madeira fraca, porém o fruto atrai a fauna e é comestivel, muito procurado pela população do campo, que o considera medicinal. Espécie pioneira, muito adaptavel e de crescimento rápido. deve ser plantado no mínimo 3 indivíduos, porque para produzir precisam existir juntas espécies macho e fêmea.
JADE AZUL (Strongylondon macrobothrys);
Jade Vermelha (mucuna bennetti);
Jambo Amarelo (Eugenia Jambos);
Jambo Rosa (Syzigium samarangense);
Jambolao (Syzigium Jambolana);
JANGADA BRAVA ( Bastardiopsis densiflora.);"A madeira da Jangada Brava pode ser empregada para caixotaria leve, confecção de brinquedos, lápis, miolo de compensados, etc. A árvore é bastante ornamental quando em flor, especialmente a planta feminina; pode ser empregada com sucesso no paisagismo em geral. Como planta pioneira de rápido crescimento, é ótima para plantios de áreas degradadas."
Jaracatiá (Jaracatia Spinosa);
Jasmim Amarelo  (Jasminum mesnyi) ;
Jasmim Estrela (Jasminum Nitidum);
Jasmim Manga (Plumeria rubra);
JATOBA ( Hymanea courbari);Considerado a faxineira do ar, o Jatobá da frutos exóticos e nutritivos. O Jatobá-verdadeiro, jatobazeiro ou apenas jatobá, é uma árvore da família das fabáceas. É a espécie arbórea dominante na floresta estacional semidecidual submontana. A espécie pode alcançar 40 metros de altura e 2 metros de diâmetro, embora uma árvore tenha atingido 95 metros na Amazônia.
Jatobá do campo 	(Hymanea Courbaril);
Name;Description
Jatobá do cerrado (Hymenaea stigonocarpa Hayne);
Jenipapo	(Jenipa americana);
JENIPAPO ( Genipa americana) ;O Jenipapo é utilizado como fortificante, estimulante do apetite, indicado contra a anemia e doenças do baço e do fígado. É rico em ferro, contém cálcio, hidratos de carbono, calorias, gorduras, água, vitaminas B1, B2, B5 e C.
JEQUITIBA BRANCO ( Cariniana estrellensis.);O Jequitibá-Branco, é uma árvore da família Lecythidaceae, possuindo nome proveniente do Tupi, e estando na lista de espécies ameaçadas do estado de São Paulo, no qual é símbolo estadual.
Jequitibá rosa (Cariniana legalis);
JEQUITIBA VERMELHO ( Cariniana legalis) Sob encomenda;Símbolo do Estado de São Paulo, o Jequitiba Vermelho é uma lindíssima árvore de grande importância histórica e ambiental, por atingir grandes dimensões de altura e diâmetro .
Jerivá (Syagrus romanzoffiana);
JILO TINGUA VERDE CLARO (Solanun gilo.);Sementes de Jiló Tinguá de coloração Verde - Clara, Solanum gilo, com frutos de diâmetro entre 4 e 06 cm . Variedades com frutos alongados, coloração verde-clara e resistência à doenças como antracnose e à murcha-bacteriana.
Jurubeba (Solanum paniculatum);
Kaizuka 	(Junipero chinensis);
Kit Adubo para Plantio (Adubo e Gel);
Kit Caipirinha;
Kit Completo Adubação: Plantio, Gel e Manutenção;
Kit Frutas vermelhas ;
Kit Jardim Francês - E-book sobre o tema;
KIT SEMENTES CAIXA MISTA MINHA HORTA;A exclusiva linha Kits de Sementes ISLA foi cuidadosamente desenvolvida com o objetivo de atender pelo menos três importantes demandas do consumidor:A primeira é que muitas pessoas tem vontade de cultivar uma horta e não sabem o que plantar, então nossos kits trazem combinações temáticas que ajudam a quem tem um pequeno espaço escolher o tipo de horta que mais lhe agrada, ou para quem tem um pouco mais de espaço e quer ter várias hortas em uma só, como uma horta de temperos, outra de hortaliças, outra de flores, etc.A segunda demanda é atender as muitas dúvidas que as pessoas tem na hora de fazer a sua primeira horta. Nossos kits acompanham um completo manual de cultivo, com as principais dicas desde o semeio até a colheita. Já a terceira demanda visa tornar o hábito de presentear com sementes ainda mais especial, um ato cheio de simbolismo e que incentiva as pessoas a resgatar o contato com a natureza e a ter uma alimentação mais saudável.
KIT SUCULENTAS ;
Kit Temperos - E-book sobre o tema;
Lágrima de Cristo (Clerodendron thomsonae);
LAMBARI ROXO ( Tradescantia zebrina);.
Name;Description
Lança de São Jorge (Sansevieria Cylindrica);Planta africana, bastante ornamental e rustica com altura de meio a um metro, pode ser plantada em ambientes internos e em ar condicionado. Gera flores que se dão na base da planta e são bastante perfumadas.
Lantana ( Lantana câmara ) ;
Laranja Azeda 	(Citrus Aurantium);
Laranja Bahia (Citrus Sinensis);
Laranja Barao (Citrus Sinensis);
Laranja Champanhe Cristal (Citrus Sinensis);
Laranja Charmute (Citrus Sinensis);
Laranja Cidra (Citrus Medica);
Laranja Folha Murcha (Citrus Sinensis);
Laranja Hamlin (Citrus Sinensis);
Laranja Imperial (Citrus Sinensis);
Laranja Lima Comum (Citrus Aurantifolia);
Laranja Lima Da Persia (Citrus Limettioides);
Laranja Lima Verde 	(Citrus Sinensis);
Laranja Natal (Citrus Sinensis);
Laranja Pera Do Rio (Citrus Sinensis);
Laranja Sanguinea (Citrus Sinensis);
Laranja Seleta 	(Citrus Sinensis);
Laranja Valencia (Citrus  Sinensis);
Laranja Zamboa (Citrus Maxima);
Name;Description
Lavanda (Lavandula sp);
LAVANDA ALFAZEMA VERDADEIRA ( Lavandula sp);A Lavanda é uma planta muito popular e adorada. Utilizada para os mais diversos fins como produtos de beleza, higiene e até mesmo doces.
LAVATERA SORTIDA ( Lavatera trimestris.);Sementes de Lavatera-de-três-meses, uma planta herbácea, anual e muito florífera originária da Região do Mediterrâneo. Com flores nas cores branca, rosa e vermelha. Sementes de flor Lavatera trimetris - Esta variedade alcança de 80 a 120 cm de altura, podendo ser utilizada para a formação de maciços e bordaduras a pleno sol, sendo ideal para a formação de renques junto a muros.
LEITEIRO ( Tabernaemontana hystrix.);Em função do tamanho, o Leiteiro também é empregado na arborização de ruas estreitas ou sob redes elétricas, por não crescer muito. As floradas, de cor branca e delicada, ocorrem nos meses de outubro-novembro.
LEUCENA ( Leucaena leucocephala.) ;Leucena (Leucaena leucocephala.), é uma planta nativa da America Central. É uma leguminosa perene, palatável com grande utilidade na alimentação de suínos, bovinos e caprinos, e sua resitência à seca foi de grande importância para sua utilização nos sistemas de alimentação de animais no Brasil Central em décadas.
Lichia (Litchi chinensis);
Licuala (Licuala grandis);
Ligustrinho Variegata (Ligustrum sinense);
LIMÃO BRAVO ( Seguieria langsdorffii.);O Limão Bravo é extremamente espinhenta e chega a medir 16 metros de altura. Possui folhas simples e um tronco que gira em torno de 50 a 70 centímetros de diâmetro.
Limao Cravo (Citrus bigaradia);
Limao Doce (Citrus Limon);
Limao Galego 	( Citrus Limon );
Limao Siciliano (Citrus Limon);
Limao Taiti (Citrus Limon);
Lírio Amarelo (Hemerocalys Flava);
Livro - Frutas, Cores e Sabores do Brasil 1 ;Um minucioso trabalho do fotógrafo Silvestre Silva, que percorreu todo o Brasil nos últimos 40 anos para documentar as mais belas e representativas plantas de nossa flora.
Livro - Frutas, Cores e Sabores do Brasil 2;Um minucioso trabalho do fotógrafo Silvestre Silva, que percorreu todo o Brasil nos últimos 40 anos para documentar as mais belas e representativas plantas de nossa flora.
Livro - Latim para Jardinistas;O livro Latim para Jardinistas é uma obra indispensável para os amantes da Natureza. Saber o que o nome de cada planta significa não é uma mera curiosidade, mas serve, principalmente, para entender suas características, como o clima que melhor se adapta, época de plantio e floração e muito mais.
Livro - Roberto Riscala: Arquitetura de Jardins;O livro Roberto Riscala – Arquitetura de Jardins, o mais novo lançamento da Editora Europa, pelo selo Biblioteca Natureza, mostra toda a versatilidade dos jardins criados pelo renomado paisagista.
LIXEIRA (  Aloysia virgata);A Lixeira é uma árvore de pequeno porte possui folhas uteis para cha ou são misturadas à erva-mate para o consumo do chimarrão. Folhas são também condimentares, utilizadas especialmente para temperos de carnes de porco.
Name;Description
Lixeira (Aloysia virgata);
Losna (Artemisia absinthium);
