Name;Description
LOURO PARDO ( Cordia trichotoma);É uma das espécies nativas com maior potencial para o plantio com fins econômicos, especialmente nas regiões Sul e Sudeste do Brasil, por apresentar uma combinação de aspectos favoráveis como: crescimento rápido, boa forma, madeira de qualidade, frutificação abundante e facilidade de produção de mudas.
MAGNOLIA AMARELA ( Michelia champaca.);No paisagismo, a Magnólia-Amarela pode ser aproveitada isolada ou em grupos, adequando-se bem a estilos orientais e tropicais. Em grupos, pode formar renques ou pequenos bosques, em grandes áreas, sempre ao longo de caminhos e estradas, onde seu perfume possa ser valorizado. Da mesma forma, plante-a isolada em locais de passagem, para que os transeuntes possam observar as flores e sentir o aroma. Cuide para não localizá-la muito próximo de janelas e portas de quartos, pois o forte perfume pode incomodar pessoas mais sensíveis.
Malvavisco (Malvaviscus arboreus Cav);
Mamão Formosa (Carica Papaya);
MAMAO PAPAIA HAWAI ( Carica papaya);Árvore de crescimento veloz ,podendo atingir 10 metros de altura , cultivada em todo mundo,produz fruto o ano todo.
Mamao Papaya (Carica Papaya);
MAMICA DE PORCA (Zanthoxylum rhoifolium.);A Mamica-de-Porca é identificada pelos seus espinhos no tronco que são parecidos com “tetas” de porca ou de cadela, sendo que seus nomes populares foram dados devido a essa característica. Sua altura varia entre 6 e 12 metros. A árvore vem da mesma família que o limão, a laranja e muitos outros frutos cítricos. Possui uma casca grossa e ocorre em todo país principalmente na Mata Atlântica.
Manacá Da Serra (Tibouchina mutabilis);
Manacá de Jardim Cheiro (Brunfelsia uniflora);
Manga Bourbon (Mangifera Indica);
Manga Espada (Mangifera Indica) ;
Manga Haden (Mangifera Indica);
Manga Palmer (Mangifera Indica) ;
Manga Rosa 	(Mangifera Indica);
Manga Tommy Atkins (Mangifera Indica);
MANJERICÃO BASILCÃO VERMELHO ( Ocimum basilicum “purpurea”);Planta de cultivo no inverno e verão. Usado na Culinária, para temperos, ensopados de carne, saladas, doces e licores.Fármacia, contra mau-hálito, inflamações na boca e garganta, cansaço, resfriado e problemas gastro-intestinais.Usa-se as folhas em infusão, decção ou pó. Pode conter 5% a 10% de plantas verdes.
Manjericão Italiano (Ocimum basilicum);
Manjericão Roxo (Ocimum basilicum);
Name;Description
Manjericão Verde (Ocimum basilicum);
MANJERONA VERDADEIRA (Origanum majorana);"A Manjerona é uma erva ou planta perene, com sabores doces do pinho e do citrino. A manjerona é cultivada para suas folhas aromáticas, verde ou seca, para o uso culinário; são cortadas enquanto as plantas começam a florescer e secados lentamente na sombra."
Maracujá Doce (Passiflora Alata);
MARACUJA REDONDO AMARELO (Passiflora edulis);O Maracujá é uma videira que cresce ate 12 metros de altura,  atrai abelhas, borboletas e aves. Suas flores possuem cheiro agrádavel e exótico.
Marcelinha (Achyrocline satureioides);
MARICÁ ( Mimosa bimucronata );"O Maricá, também chamado espinho-de-maricá, espinheira, espinho-de-cerca e espinho-roxo, é um arbusto de caule tortuoso da família das leguminosas. É comum em solos úmidos e brejosos. Tem altura entre 6 e 10 metros. É encontrada no Brasil em vários estados; por exemplo, no Rio Grande do Sul."
Maricá (Mimosa bimucronata);
MARMELADA DO CERRADO ( Cordiera sessilis) Sob encomenda;Fruto de sabor agradável e um suco de alta qualidade, a Marmelada-do-Cerrado é encontrada no cerrado, tendo outras variedades com o mesmo nome popular. Ja é tida como uma fruta rara, pois com a pecuária e agricultura extensiva, seu habitat se tornou bastante reduzido, sendo que é cada vez mais difícil encontra-la naturalmente.
Marmelo (Cydonia Oblonga);
MAROLO ( Annona coriacea. ) ;Fruto muito apreciado na sua região de origem, os cerrados de vários estados brasileiros, de Minas Gerais ao Piauí, sendo mais raro em São Paulo e no Paraná. É comercializado em mercados locais, coletado de plantas nativas, pois não há plantações comercias. É apreciado por sua polpa adocicada e aromática de cor alaranjada e levemente ácida.
MAXIXE (Cucumis anguria.);Cucumis anguria, conhecido popularmente como maxixe, é uma planta rasteira ou trepadeira anual e de clima quente. Seus frutos comestíveis, chamados de maxixe ou galinha-arrepiada, têm casca verde, são ovalados e possuem pequenos espinhos moles e não pontiagudos. Suas sementes são achatadas.
MELANCIA CRINSON SWEET (Citrullus lanatus);Frutos redondos de cor verde clara com listras verde mais escuras - extremamente doce.Resistente à Antracnose e à Fusarium.Semente pequena e parda.
MELANCIA FAIRFAX ( Citrullus lanatus.);Frutos alongados de cor verde clara com listras grossas verde escuras.Semente branca com pontas preta.
Melissa (Melissa officinalis);
MELISSA ERVA CIDREIRA (Melissa officinalis L);"A Erva-cidreira, também conhecida popularmente como ""Erva Cidreira Verdadeira"", é uma planta perene herbácea da família da menta /hortelã e do boldo, nativa da Europa meridional. O seu sabor e aroma característicos, frutado, de limão, principalmente nas folhas, deriva do seu óleo essencial do grupo dos terpenos."
Mexerica poncã (Citrus spp);
Mil Folhas (Achillea millefolium);
Mini Bambu (Fargesia adpressa);Mini bambu de cor verde forte, entouceirante, atinge 60 cm de altura. Com folhas pontiagudas, é  muito bom para forração e ornamentação de  canteiros, taludes ou aterros.
Mini Flamboyant (Caesalpinia pulcherrima);O mini Flamboyant é belíssimo, sua árvore, de pequeno porte, podendo chegar de 3 á 4 metros de altura. Pode ser plantada em vasos grandes e é muito decorativa para seu jardim, atraindo abelhas e borboletas .
Mini Gardênia (Gardenia augusta);
Name;Description
Mini Lantana Amarela (Lantana camara);
MIRINDIBA ( Lafoensia glyptocarpa.);A Mirindiba-Rosa é uma árvore tropical bastante rústica e ornamental, indicada para a arborização urbana e recuperação de áreas degradadas. Seu crescimento é moderado a rápido e seu porte é médio, alcançando de 8 a 15 metros de altura.
Mirra (Commiphora myrrha);
Mogno (Swietena Nacronthylla);
MOGNO AFRICANO ( Khaya grandifoliola.);O Mogno Africano é hoje uma das principais madeiras nobres cultivada no Brasil, importante pelo seu valor econômico, cada hectare plantado pode obter 193,32 m³ de madeira serrada
MOGNO BRASILEIRO ( Swietena nacronthylla ) ;O Mogno, nativa da selva Amazônica, bastante conhecida pela qualidade da sua madeira é uma árvore de crescimento rápido que atinge até 4 metros de altura.
Monstera (Monstera deliciosa);
MORANGA DE MESA ( Cucurbita maxima.);A Moranga de Mesa  são frutos com formato globular achatado e com gomos. Essas morangas possuem cor da casca e polpa laranja, atingem de 20 a 35 cm de diâmetro, de 10 a 15 cm de altura e pesam de 2 a 5 quilos. Essa moranga é ideal para rechear com camarões ou carne seca ou qualquer outro recheio. Seu nome científico é Cucurbita maxima.
Moréia amarela (Dietes bicolor);
Moréia Branca (Dietes Iridioides);
Moringa 	(Moringa Oleifera);
MORINGA (Moringa oleiofera ) ;Mudas com 1,5 m
Muda Blueberry com Vaso Marrom 30X30;
Muda de laranja Imperial com vaso vermelho ;
MULUNGU (Erythrina velutina);O Mulungu (Erythrina velutina), também conhecido como canivete, bico-de-papagaio e corticeira, é uma planta medicinal muito eficaz no tratamento de problemas psicológicos relacionados ao estresse.
Mulungu (Erytrina velutina);
MULUNGU DO LITORAL ( Erythrina speciosa) ;A árvore é utilizada no sombreamento de cacaueiros. Sua casca produz uma tintura amarela e tem propriedade tânica, suas flores são alimentícias, quer cruas ou cozidas. Maceradas produzem uma tinta amarelo-avermelhada boa para tingir panos.
Murta (Murraya paniculata);
MURTA (Murraya Paniculata) muda, altura até 0,60m;
MURTA DE CHEIRO (Murraya paniculata);A Murta-de-cheiro é um arbusto grande ou arvoreta, que pode alcançar até 7 metros de altura. Na antiguidade, os ramos floridos de murta-de-cheiro eram usados para confeccionar arranjos que adornavam os cabelos das noivas.
Name;Description
MUTAMBO (Guazuma ulmifolia);Própria para plantio em áreas como ruas, avenidas, praças, parques, jardins e margens de corpos d'água. Pode ser usada em áreas de paisagismo, para caixotaria, carvão, frutíferas para pássaros, mata ciliar e uso para sombra. Com sua madeira pode-se produzir carvão de alta qualidade que pode ser transformado em pólvora. Possui flores masculinas amareladas e femininas róseas ou lilases.
Mutambo (Guazuma ulmifolia);
Nandina (Nandina domestica);
Nim 	(Azadirachta indica);
Noni (Morinda citrifolia);
NONI (Rubiaceae);Noni é o nome da fruta amarelinho esverdeada da imagem acima. A fruta noni vem da árvore cujo nome científico é Morinda citrifolia, originária do sudeste asiático, mas cultivada com mais frequência no Taiti.A fruta noni, normalmente consumida com suco de uva, possui benefícios. Mas a venda de produtos processados de noni é proibida no Brasil.
Noz Pecan (Carya Illinoiensis);
Oiti (Licania Tomentosa);
OLHO DE DRAGÃO (Dimocarpus longan.);Quando está fresca, a fruta é adocicada e lembra o sabor do melão. Nesse estado, é indicada para reduzir febres. A fruta seca, por outro lado, ajuda a acabar com a insônia. Em suas folhas, a longan contém antioxidantes como a quercitina, que ajuda a prevenir o envelhecimento precoce das células, e substâncias antivirais, que ajudam a combater a aliviar os sintomas de gripes e resfriados. Além disso, o olho de dragão ainda conta com propriedade calmantes e tonificantes.
Orégano (Origanum vulgare);
Orelha de Gato  ( Kalanchoe tomentosa );Parece uma Kalanchoê comum, mas não é! Cheia de pelinhos, em tom acinzentado com manchinhas marrons nas bordas, a Orelha de Gato é bem diferente das demais kalanchoês do mercado. Toda delicada, ela compõe os canteiros lembrando uma orelhinha de gato bem macia.
ORELHA DE NEGRO (Enterolobium contortisiliquum.);Orelha de Negro é bastante ornamental, principalmente quando em intensa floração. Pode ser utilizada no paisagismo em geral com bastante sucesso. Pode ser também empregada em reflorestamentos mistos destinados à recomposição.
Orelha de Shrek  ( Crassula ovata gollum );"Famosa Orelha do Shrek! Folhas tubulares e com ""ventosas"" nas pontas, que podem aparecer em tom mais avermelhado. Esta variedade pode chegar a 80 cm, e deixa qualquer cantinho mais divertido."
Orquídea Bambu (Arundina Bambusifolia);
Orquídea Chuva De Ouro (Oncidium sp);
Os Grandes Paisagistas da Natureza livro 1;Confira os 30 paisagistas que fazem parte do livro: Airton dos Santos, Alex Hanazaki, Alex Sá Gomes, Alexandre Furcolin, Alexandre Galhego, Ana Holzer, Ana Maria Bovério, Benedito Abbud, Caterina Poli, Claudio Pedalino, Daniel Nunes, Eduardo Gonçalves, Evani Kupferman Franco, Gil Fialho, Gilberto Elkis, Guga, Gustaaf Winters, Luiz Carlos, Brasil Orsini, Juliana Freitas, Marcelo Bellotto, Marcelo Faisal, Marcelo Novaes, Maria Luiza Aceituno, Mauro Barros, Raul Cânovas, Roberto Riscala, Rodrigo Oliveira, Sergio Santana, Toni Backes, Walkiria Fernandes.
Os Mais Belos Jardins do Mundo: Jardins de Kew Gardens;Jardins de Kew Gardens. Dono da maior e mais diversificada coleção de plantas em todo o mundo, Kew Gardens é considerado um dos mais importantes – se não o mais importante – jardins botânicos do planeta. Nada mal para algo que começou de forma despretensiosa há cerca de 260 anos.
Os Mais Belos Jardins do Mundo: Jardins de Mainau;Conheça a história e encante-se com belas imagens de Mainau, a ilha alemã que foi transformada em incrível jardim.
Os Mais Belos Jardins do Mundo: Palácio de Versalhes;Você vai conhecer os diferentes jardins e bosques que compõem o complexo, a famosa Orangerie, o Grand Trianon e o Petit Trianon, o refúguio da rainha Maria Antonieta.
Pacová (Philodendron martiaum);
Name;Description
Paineira 	(Ceiba speciosa);
PAINEIRA ROSA ( Ceiba speciosa ) ;A Paineira Rosa é uma planta excelente para o paisagismo, principalmente por causa de sua floração.
Palmeira azul (Bismarckia nobilis);
Palmeira Carpentaria 	(Carpentaria acuminata);
Palmeira Chamaedórea (Chamaedorea elegans);
Palmeira Fenix (Phoenix Roebelenii);Palmeira exótica e elegante, atinge 3 a 4 metros, muito útil para pequenos espaços como terraços, ornamentação, pode ser plantada em meia sombra e em vasos. Seus frutos são apreciados pelos pássaros.
Palmeira Imperial (Roystonea Oleracea);
PALMEIRA IMPERIAL DE CUBA ( Roystonea regia.) ;A Palmeira Real-de-Cuba é uma espécie majestosa, de estipe único e grande porte, originária da Flórida, México, América Central e do Caribe, e amplamente utilizada como ornamental em regiões tropicais. Até pouco tempo, a palmeira-real-de-cuba e a palmeira-da-flórida eram consideradas espécies distintas, sendo esta última nomeada como Roystonea elata.
Palmeira Rabo de Raposa (Wodyetia bifurcata);
Palmeira rafis (Raphis excelsa);
Palmeira Real 	(Archontophoenix cunninghamiana);
Palmeira Triangular (Dypsis Decary);
Palmeira Washingtonia (Washingtonia Robusta);
Palmito Jussara (Euterpe edulis);
PARICÁ (Parapiptadenia rigida);O Paricá é parente do Guapuruvu, árvore da floresta atlântica. Seu nome científico é: shizolobium amazonicum. É uma árvore da família das leguminosas que capta nitrogênio do ar e o fixa no solo. Na mata nativa, o florescimento acontece na época da seca e atrai dezenas de insetos. A árvore fica carregada de flores amarelas que deixam no ar um perfume delicado e doce.
Pata De Elefante (Beucarnia Recurvata);
Pata De Vaca (Bauhinea Forticata);
PAU AMENDOIM (Pterogyne nitens tul.);Sementes Amendoim-Braco ou Pau amendoim, árvore Rústica e de crescimento rápido, com flores Amarelas-esverdeadas e perfumadas
Pau Brasil (Caesalpinea Echinata);
PAU CIGARRA (Senna multijuga. );O Pau-Cigarra, bem como outras cássias, são muito apreciadas pelas cigarras. A morte sem sinal aparente dessas árvores é muito comum, em virtude da sucção contínua da seiva das raízes por larvas em grande quantidade, e até mesmo adultos, de cigarras¹.
Name;Description
Pau D'alho (Gallesia Integrifolia);
PAU DÁLHO ( Gallesia integrifolia);Planta exala cheiro de alho em dias de chuva ou de umidade relativa alta. É pioneira, excelente para reflorestamentos.
PAU DE VIOLA (Tabebuia cassinoides.);O Pau Viola é encontrado em florestas e matas úmidas e alagadas do Sudeste, Nordeste e Sul do Brasil. Indicada principalmente para o plantio na faixa litorânea e em terrenos úmidos e até brejosos, além da margem de rios e represas. Recebe vários nomes como: pau-de-viola, tucaneira, jacareúba, baga-de-tucano, pombeiro, tarumã e tarumã-branco, devido a cor das flores.
PAU FAVA ( Senna macranthera.);Senna macranthera é uma árvore da família das Fabaceae. Com uma altura de 6 a 9 m, tem uma abundância de flores amarelas de dezembro a abril em suas terras natais.
Pau Ferro (Caesalpinia Ferrea);
Pau formiga 	(Triplaris Americana);
PAU FORMIGA ( Triplaris americana);O Pau-formiga é uma árvore tropical majestosa, que impressiona por seu porte e florada exuberantes. Sua copa tem formato colunar a piramidal, com tronco retilíneo, elegante e oco, abrigando formigas em seu interior, numa interessante relação de simbiose.
PAU JANGADA (Alchornea triplinervia.);A madeira é empregada na confecção de jangadas, pequenas embarcações e para o fabrico de pasta celulósica. A casca fornece material para confecção de cordas. A árvore possui folhagem muito decorativa, e pode ser incluída no paisagismo, principalmente na arborização de praças e avenidas. Como planta pioneira e de rápido crescimento, pode ser aproveitada para o reflorestamento de áreas degradadas de preservação permanente.
PAU MARFIM (Calycophyllum spruceanum.);Pau Marfim é um nome usado para indicar pelo menos duas variedades de madeiras, oriundas da árvore Agonandra brasiliensis e, menos frequentemente, Balfourodendron riedelianum, que também é conhecida por Farinha Seca.
PAU MULATO ( Calycophyllum spruceanum);O Pau Mulato é uma árvore nativa da amazônia e de reconhecido valor ornamental, principalmente pela beleza escultural do seu tronco.
Pau Mulato (Calycophyllum Spruceanum);
PAU SANTO (Kielmeyera variabilis Mart. & Zucc.);Árvore belíssima para o paisagismo muito pesada, dura e resistente, de odor agradável e alta durabilidade. Empregada no fabrico de peças que exijam grande resistência ao desgaste, como buchas e hélices de embarcações. Também é excelente para trabalhos de tornos, sendo com ela confeccionadas peças artesanais valiosas encontrados com frequência no comércio dos países vizinhos citados, como: cinzeiros, vasos, copos, cofres, bastonetes, pedestais, suportes, utensílios diversos etc.
Pedra da lua ( Pachyphytum oviferum);A Pedra da Lua é uma das suculentas mais fofas que tem, com sua folha ovoide, com coloração levemente prateada, o resultado do verde-escuro das folhas com a fina camada esbranquiçada que as encobre resultada em seu nome popular. Sua inflorescência pendente é composta por até 15 flores vermelhas e em forma de sino.
PEITO DE POMBO (Tapirira guianensis);Árvore pioneira, atinge até 15 metros de altura. É muito procurada pela fauna, especialmente pássaros. Fruto comestível, porém, pouco apreciado devido a pequena quantidade de polpa.
Peito de pombo (Tapirira Guianensis);
Pequi (Caryocar Villosum);
Peroba (Aspidosperma cylindrocarpon);
PEROBA ROSA ( Aspidosperma polyneuron ) Sob encomenda;Árvore longeva com madeira de boa qualidade é muito ornamental. Pelo seu porte e beleza é apreciada pelos brasileiros.
PESSEGO DO MATO (Eugenia myrcianthes.);O Pêssego do Mato ou cerejeira-do-rio-grande é uma árvore frutífera brasileira da família Myrtaceae. Seus frutos são muito apreciados inclusive pelas aves. Arbusto entouceirado ou árvore de até 10 m de altura e 40 cm de diâmetro à altura do peito, com casca espessa, acinzentada e com fissuras longitudinais.
Pigmeu Joshua Tree  ( Sedum multiceps);Vindo da Argélia, a Pigmeu Joshua Tree apresenta folhas carnosas quase cilíndricas e muito atrativas. As inflorescências, que surgem em grande quantidade durante o Outono e Inverno, são compostas por inúmeras flores amarelas em forma de estrela, dispostas acima da ramagem.
Name;Description
Pimenta Biquinho (Capsicum chinense);
PIMENTA BOYRA HABANERO VERMELHA ( Capsicum frutescens.);Sementes de Pimenta, da variedade Boyra Habanero Vermelha, espécie Capsicum chinense, um pimenteira de frutos muito picantes utilizados em diversos pratos e conservas.
PIMENTA CUMARI DO PARAGUACI (Capsicum Fructes-cens.);Muito popular na região sudeste do Brasil, a Pimenta Cumari, possui frutos bem pequenos, arredondados ou ovalados de colaração vermelha quando maduros
PIMENTA DE CAYENNE DEDO DE MOÇA (Capsicum baccatum);Planta que gera frutos alongados e pendentes, apresentam coloração verde amarelada quando imaturos e vermelha quando maduros, com cerca de 1,4 cm de largura, 6,0 cm de comprimento e 1,6 mm de espessura de parede.
Pimenta Dedo de Moça (Capsicum baccatum);
Pimenta Malagueta (Capiscum spp.);
PIMENTA MALAGUETA (Capsicum frutescens Capsicum annuum L);É uma das pimentas mais conhecidas pelos brasileiros, que a consomem principalmente em conserva.  A malagueta é originária da Bacia Amazônica. Além de ser bastante produzida no Brasil, é também cultivada em Portugal, África e Ásia.  Os tripulantes que acompanhavam Cristovão Colombo em sua expedição que primeiro entraram em contato com essa iguaria. O nome malagueta era anteriormente dado para a Pimenta da Guiné, que hoje já não é mais usada na cozinha.
PIMENTAO ALL BIG (Phytophthora capsici);O Pimentão All Big é uma planta de crescimento ereto. Os frutos medem cerca de 12 x 10 cm. Polpa firme, grossa e de sabor doce. É rico em minerais e vitaminas A e C. Pode ser recheado com carne moída.
Pingo de Ouro (Duranta erecta aurea) ;
PINHA ( Annona squamosa);A Annona squamosa, popularmente Fruta do Conde ou ata no Brasil (Pará, Piauí, Maranhão, Ceará e Goiás) ou fruta-pinha (Angola), é uma árvore frutífera do gênero Annona originária provavelmente do Caribe
Pinhao (Araucaria angustifólia);
PINHÃO MANSO ( Jatropha curcas.);Jatropha curcas é uma espécie de planta da família Euphorbiaceae conhecida pelos nomes comuns de purgueira, pinhão-manso, jatrofa, mandubiguaçu, pinhão-de-purga e pinha-de-purga.
PITANGA ( Eugenia uniflora);A Pitangueira é uma árvore ou arbusto frutífero e ornamental, nativo da mata atlântica e conhecido principalmente pelos frutos doces.
Pitanga (Eugenia uniflora );
Pitaya (Hylocereus sp.);
Pitomba (Talisia esculenta);
Planta Fantasma  ( Graptopetalum paraguayense ) ;Sua coloração esbranquiçada sugere seu nome: Planta Fantasma. As folhas carnudas levam um pó branco em cima e deixa a planta com aspecto fantasmagórico. Com poucas flores estreladas de cor branco creme, vezes ou outra elas aparecem para enfeitar o jardim.
Planta Jade  ( Crassula ovata );A Planta Jade é uma suculenta muito forte e resistente. Tem folhas ovaladas, não muito carnudas, mas sua estrutura pode chegar a 2 metros de altura. De tom predominantemente verde escuro, suas flores são pequenas e brancas.
Plantas Alimentícias Não Convencionais - PANC ;Guia de identificação, aspectos nutricionais e receitas ilustradas.
Plantas para atrair Beija- Flor ;60 espécies para dar vida e cor ao seu jardim: Arbustos, árvores, bromélias, herbáceas, suculentas e trepadeiras.
Name;Description
Plantas que crescem rápido - E-book sobre o tema;
Podocarpos - Podocarpus Macrophyllus;Planta versátil, útil para cerca viva, aceita poda para qualquer altura e atraí passarinhos. Vai bem em vasos e serve para varias situações paisagísticas. Também é possível fazer bonsai.
Poejo (Mentha pulegium);
Pomar de Cítricas ;
Pomar para Compotas ;
Pomar para Geleias ;
PORTULACA DOBRADA SORTIDA ONZE HORAS ( Portulaca grandiflora);Sementes de Onze Horas, uma das raras plantas suculentas que tem ciclo de vida anual. É também umas das floríferas anuais mais apreciadas no mundo todo, pelo seu fácil cultivo e abundante floração. Seus ramos são ramificados e suas folhinhas suculentas. As flores terminais são grandes e vistosas, e dobradas nesta cultivar, em diversas cores e mesclas, como o branco, vermelho, rosa, laranja e amarela. Elas se abrem pela manhã e se fecham à tarde, mas apenas em dias ensolarados. A floração ocorre nos meses mais quentes.
Pragas e Doenças do Jardim ;Conteúdo inédito no Brasil e preparado com o apoio dos editores da Revista Natureza, a maior revista de jardinagem e paisagismo do Brasil.
Primavera Americana (Bougainvillea Spectabilis);
PUPUNHA ( Bactris gasipaes.);A árvore da pupunha pode atingir 20m de altura, 25cm de diâmetro e seu tronco tem regiões intercaladas com  e sem espinho. Seus frutos jovens são verdes e maduros, amarelados ou avermelhados, não podem ser ingeridos antes do cozimento, porque apresentam substâncias que provocam irritação na mucosa da boca.
QUARESMEIRA ( Tibouchinea granulosa);De beleza notável, que encanta, é uma árvore que da flores além de ser pioneira e perfeita para decorar calçadas.
Quaresmeira (Tibouchinea Granulosa) ;
Quebra Demanda (Gendarussa vulgaris);
QUIABO SANTA CRUZ (Abelmoschus esculentus.);Tipo de Quiabo de alta produtividade e excelente uniformidade de planta e frutos, que têm como característica serem cilíndricos com ponta, sem fibras e de casca verde claro, além de possuírem grande resistência à podridão bacteriana. Os frutos ainda podem ser utilizados tanto para consumo fresco, como para processamento na forma de molhos líquidos e desidratados.
RABANETE VERMELHO COMPRIDO (Raphanus sativus.);"O Rabanete tem ciclo rápido e é de fácil cultivo; É uma planta que produz uma raiz muito saborosa e bastante consumida, principalmente crua e em saladas. Além disso, é considerada uma planta com aplicações medicinais, principalmente no tratamento de artritismo ou como diurético e tranquilizante."
Rabo de Burro ( Sedum morganianum );O Rabo de Burro chega à 60 cm com folhas carnudas, azul esverdeadas. A inflorescência carrega de 1 a 6 flores cor-de-rosa. Esta variedade é perene e bastante conhecida, no entanto é bem frágil para toque.
Rambutan (Nephelium Lappaceum);
Ravenala (Ravenala madagascariensis);
Renda Portuguesa (Davallia Fejeensis);
REPOLHO ROXO (Brassica oleracea var. capitata f. rubra.);O Repolho Roxo é um tipo de repolho, também conhecido como repolho roxo, kraut vermelho ou kraut azul após a preparação. Suas folhas são de cor vermelho escuro / roxo. No entanto, a planta muda de cor de acordo com o valor de pH do solo, devido a um pigmento pertencente às antocianinas.
Name;Description
REPOULHO LOUCO DE VERÃO ( Brassica oleracea var capitata.);"Sementes de Repolho Louco de Verão, Brassica oleracea var. capitata. Repolho de Cabeças redondas, firmes e uniformes para cultivo no verão;."
Resedá (Lagerstroemia indica);
RESEDA GIGANTE (Lagerstroemia speciosa);O Resedá Gigante é uma planta da família Lythraceae. A árvore é nativa da região tropical da Índia e é cultivada como planta ornamental nos Estados Unidos.
Romã (Punica Granatum);
Rosa de Pedra black prince ( Echeveria affinis ) ;Suculenta em roseta com coloração roxa escura, e miolo verde. É uma variedade rara mas de fácil cultivo. Suas flores são pequenas e vermelhas.
