Name;Description
CABREÚVA (Myroxylon peruiferum);
Cactos e Outras Suculentas;Além de uma completa explanação sobre este grupo de plantas e o seu cultivo, a obra é completada por um capítulo descritivo sobre o seu uso na decoração.
CAJÁ MANGA (Spondias cytherea);
CAJA MIRIM (Spondias mombin.);O Cajá-Mirim faz parte da mesma família de outras frutas como o umbu, a ciriguela, a cajarana e a cajá-manga. A madeira dessa árvore é considerada leve e mole e, portanto, fácil de trabalhar. Tanto que é própria para marcenaria e carpintaria. No Norte, inclusive, é empregada para a construção de pequenas embarcações. Embora tenha uma boa germinação, ela costuma ser demorada.
CAJÚ (Anacardium occidentale);
CAJU AMARELO (Anacardium occidentale);Nativo do nordeste brasileiro, o Caju é indicado também para pomares domésticos por não exigir cuidados especiais. Melhor colheita é realizada de Agosto a Janeiro.
CAJU VERMELHO ( Anacardium occidentale);Nativo do nordeste brasileiro, o Caju é indicado também para pomares domésticos por não exigir cuidados especiais. Melhor colheita é realizada de Agosto a Janeiro.
CALABURA (Muntingia calabura);
CALANCHOE ANÃO (Kalanchoe pumila);O Kalanchoê anão é uma crassulácea com hastes arqueadas de folhas congeladas, e cachos de flores rosa com veias roxas na Primavera.
CALENDULA BONINA SORTIDA ( Calendula officinalis);Calendula officinalis, conhecida como calêndula ou margarida é uma planta do género Calendula. Era usada na Grécia, Roma, Arábia e Índia antigas como planta medicinal bem como corante têxtil, corante alimentar e em cosméticos.
Name;Description
CALIANDRA (Calliandra tweedii);
CALISTEMON (Callistemon spp);Destacada como árvore isolada no paisagismo é usada também como cerca – viva. Muito exótica com sua beleza singular, pode chegar até 7 metros de altura.
CALISTEMON VIMINALIS ( Callistemon spp);Destacada como árvore isolada no paisagismo é usada também como cerca viva. Muito exótica com sua beleza singular, pode chegar até 7 metros de altura.
CAMARÃO AMARELO (Pachystachys lutea);
CAMARÃO VERMELHO (Justicia brandegeana);Sua floração é muito interessante e delicada no paisagismo. É adequada para formação de bordaduras e multiplicada em ramagem, podendo chegar a alcançar 1 metro de altura atraindo muitas borboletas e beija - flor.
CAMBUCÁ (Marlierea edulis);
CAMBUCI (Campomanesia phaea);
CAMOMILA (Chamomilla recutita (L.) rauschert);
CAMU CAMU ( Myrciaria dubia.) Sob encomenda;O Camu-Camu, caçari, ou araçá-d'água (Myrciaria dubia H. B. K. (McVough) é um arbusto ou pequena árvore, pertencente a família Myrtaceae, disperso em quase toda a Amazônia, encontrado no estado silvestre nas margens dos rios e lagos, geralmente de água preta. Em seu habitat natural a planta pode permanecer submersa por 4 a 5 meses.
CANAFÍSTULA (Peltophorum dubium);A Canafístula é uma excelente opção para o paisagismo urbano ou rural. Ela produz sombra fresca no verão e perde parte ou todas as folhas no inverno. Sua floração é um verdadeiro espetáculo de flores amarelas e forma um tapete de pétalas no chão. Ecologicamente é considerada uma importante árvore oportunista, que se beneficia de clareiras, sendo por este motivo utilizada em recuperação de áreas degradadas.
CANAFÍSTULA (Peltophorum dubium);
CANAFISTULA BRANCA FAVEIRA ( Peltophorum dubium);A Canafístula é uma excelente opção para o paisagismo urbano ou rural. Ela produz sombra fresca no verão e perde parte ou todas as folhas no inverno. Sua floração é um verdadeiro espetáculo de flores amarelas e forma um tapete de pétalas no chão.
CANDEIA(Gochnatia polymorpha);
CANDEIA/CAMBARÁ PEROLA (Gochnatia polymorpha.);A Candeia é uma espécie recomendada para reconstituição de ecossistemas degradados. Apresenta copa rala. Propicia processo secessional rico e diversificado, desde que haja, nas proximidades, fontes de sementes de outras espécies. As folhas dessa espécie são empregadas na medicina popular, em forma de chás, nas afecções bronco-pulmonares como expectorante e como emoliente. Espécie utilizada em arborização de ruas e avenidas e plantada em parques e praças.
CANELINHA (Nectandra megapotamica);A Canelinha é destacada como árvore isolada no paisagismo e usada também como cerca viva. Muito exótica com sua beleza singular, pode chegar até 7 metros de altura.
CANELINHA(Nectandra megapotamica);
CÂNFORA (Cinnamomum camphora);
CANJAMBO (Guarea kunthiana.);Árvore nativa do Brasil, que produz frutos de grande beleza em pencas, conhecidos como figo do mato. Frutos atrativos para muitos tipos de pássaros, principalmente tucanos. Ótima árvore para utilização em reflorestamentos de áreas degradadas, por ser nativa e atrativa de pássaros e animais da fauna.
CAPIM BRANCO (Penicetum villosum (Chloris polydactyla));Otimo para ornamentar jardins e fazer forrações com até 60 cm de altura, penicetum villosum tem boa floração que é de cor branca. Aceita poda para qualquer altura e é muito bonito.
CAPIM CHORÃO (Pennisetum setaceum);O capim-chorão é uma gramínea de folhagem bastante decorativa. Sua folhas são longas, lineares, curvas e muito finas. De baixíssima manutenção, também presta-se como forração, principalmente em taludes, onde pode demonstrar sua grande capacidade de controlar a erosão.
Name;Description
CAPIM CITRONELA (Cymbopogon winterianus);Contra Aedes aegypti e moscas, citronela é ótima solução.  Com um metro e meio de altura esse capim possui mais de oitenta componentes que afugentam mosquitos.
CAPIM DOS TEXAS (Pennisetum setaceum rubrum);Capim do Texas é uma forração ornamental muito bonita, fecha canteiros e jardins. Pode ser cultivada em vasos ou jardineiras, também. Planta muito resistente, resiste a geadas e até fogo com posterior rebrota. Atinge 1,20 metro de altura.
CAPITÃO DO CAMPO (Callisthene fasciculata.);Capitão-do-campo é uma árvore brasileira pioneira, nativa da floresta estacional semidecidual e do cerrado dos estados de Minas Gerais, Goiás, Mato Grosso do Sul e São Paulo.
CAPIXINGUI ( Croton floribundus.);Capixingui é uma espécie nativa no Brasil, não endêmica, pioneira, muito comum em bordas e clareiras de florestas ombrófilas e estacionais do Brasil.
CAPOROROCA ( Rapanea ferruginea);Capororoca é o nome vulgar brasileiro das árvores do gênero Myrsine da família Myrsinaceae. São árvores de porte pequeno a médio, portando folhas simples com margens inteiras em disposição alternas no caule. Os frutos da planta são drupáceos.
CAPUCHINHA (Tropaeolum majus);
CAQUI (Diospyrus kaki L.);
CARAMBOLA (Averrhoa carambola);
CAROBA ( Jacaranda macrantha);A Caroba é uma planta muito comum no Brasil,têm aplicação ornamental,devido à beleza de suas flores arroxeadas.
CARQUEJA (Baccharis trimera (Less.) DC);
CÁSSIA DO NORDESTE ( Senna espectabilis);Cassia spectabilis é uma árvore da família das fabáceas, sub-família Caesalpinioideae, conhecida por diverosos nomes vulgares como Cássia, Cássia-do-nordeste, Cássia-macranta, Cássia-macrantera, Fedegoso. É uma planta com origem no Brasil. É uma árvore de crescimento rápido, que atinge um porte de 4 metros de altura, para 4 metros de diâmetro da copa arredondada. As folhas são pequenas e caducas. A floração decorre entre março a abril e origina flores de cor amarela.
CASSIA VERMELHA (Cassia renigera.);A Cássia Vermelha é uma árvore de florescimento majestoso, o que a torna adequada para arborização de parques e praças, em plantios isolados ou formando grupos. Frutos com aroma de alcaçus.
CATA-VENTO DA HAWORTH (Aeonium haworthii);Conhecida como Cata Vento, esta suculenta nativa da África assume folhas em formato de rosetas em dupla cor: verde no centro, e vermelho nas pontas e bordas. Dica: no sol a coloração vermelha se intensifica.
CATA-VENTO DE COBRE (Aeonium sunburst) sob encomenda;O Cata Vento de Cobre é uma espécie bem colorida pois possui cores diferentes em seus folhas, variando entre verde claro, escuro, branco e amarelo. E para algumas plantas, pontos em tom rosado. E no verão produzem flores brancas!
CEBOLA CRIOULA (Allium cepa.);Alta produtividade, com grande uniformidade de bulbos e ótimo conservação pós colheita.
CEBOLA CRIOULA ROXA (Allium cepa.);Alta produtividade, com grande uniformidade de bulbos e ótimo conservação pós colheita.
CEBOLA NIRA (Allium tuberosum);
CEBOLA WHITE CREOLA ( Allium cepa.);Alta produtivida. Grande uniformidade de bulbos. E ótima conservação pós colheita.
CEBOLINHA (Allium fistulosum);
CEBOLINHA DE TEMPERO TODO ANO (Allium fistulosum);A Cebolinha é um clássico tempero que faz parte de quase todos os jardins e hortas. Sua produtividade é o ano inteiro e com uma boa terra adubada suas folhas podem atingir o tamanho bem maior do que os encontrados em mercados em geral.
Name;Description
CEBOLINHA TODO ANO ORGÂNICA (Allium fistulosum);"Folhas com coloração verde médio. Boa capacidade de perfilhamento, macia e de sabor agradável."
CEBOLINHA VERDE ( Allium fistulosum);É uma planta vivaz, que se desenvolve em tufos muito densos. Apresenta folhas verde-escuras, roliças, que atingem no máximo 30 cm de altura. A cebolinha é indicada para ser cultivada, principalmente, em plantios domésticos.
CEDRO ROSA (Cedrela fissilis);
CEDRO ROSA (Cedrela fissilis );Planta decídua que ocorre preferencialmente em solos úmidos e profundos, como os encontrados em vales e planícies.Desenvolve-se no interior de florestas primárias, mas também pode ser encontrada em capoeiras. O Cedro-Rosa é utilizado em construções civis, decoração, mobiliário, embalagens, chapas condensadas, instrumentos musicais ou parte deles, molduras para quadros, caixa de cachimbo. Também é utilizada na medicina, no combate a febre, feridas e úlceras. É utilizada como arborização de praças públicas, parques e jardins e também tendo a finalidade de recuperar ecossistemas degradados.
CENOURA BRS ESPLANADA ( Daucus carota L.);"Recomendada para processamento (cenouretes).Resistente a queima das folhas. Quanto menor o espaçamento mais finas serão as raízes. Alto teor de caroteno."
CENOURA NANTES CALIBRADA MÉDIA (Daucus carota L.);Variedade adaptada para o inverno. Excelente sabor. Rica em sais minerais e vitamina A. Raiz de formato cilíndrico, lisa, de excelente sabor e tamanho médio de 16 x 3 cm.
CEREJEIRA (Amburana cearensis);Cerejeira é o nome dado a várias espécies de árvores frutíferas de clima temperado cuja maioria são originárias da Ásia, algumas frutíferas, outras produtoras de madeira nobre. Estas árvores classificam-se no subgênero Cerasus incluído no gênero Prunus.
CHÁ DE BUGRE (Cordia sellowiana.);O Chá de Bugre é indicada para paisagismo, possui madeira pesada, usada na construção civil, na marcenaria, na carpintaria e como lenha. Suas folhas são usadas na medicina popular como depurativas, anti-reumáticas, cicatrizantes e anti-inflamatórias, além de excelente ação contra picadas de jararaca e cascavel através do uso de infusão da casca.
CHEFLERA (Schefflera actinophylla.);Schefflera arboricola é uma planta da família Araliaceae, nativa de Taiwan e de Hainan. Seu nome comum é árvore de guarda-chuva anão, pois parece ser uma versão menor da árvore de guarda-chuva, Schefflera actinophylla.
CHEFLERA (Schefflera arboricola);
CHICORIA ESCAROLA LISA (Cichorium endivia 'latifolium.);Variedade de folhas lisas e cor verde escura. Ciclo de 60 dias no verão e 80 dias no inverno. São plantas que preferem épocas mais frias do ano.
CHIFRE DE VEADO (Platycerium bifurcatum);
CICA (Cycas revoluteo);Planta pré-histórica do período jurássico (dinossauros!), ornamental, pode ser plantada em vasos e parece com uma palmeira. Atinge três metros e possui folhas longas
CINAMOMO GIGANTE (Melia azedarach.);A árvore é cultivada como ornamental e para sombra em todos países tropicais do mundo. A madeira é utilizada para lenha, carpinteiria, caixas, cabos de ferramentos e brinquedos. O fruto é considerado vermífugo, mas usado em quantidade elevada é venenoso. As folhas são usadas externamente, no tratamento das adenites. As variedades tóxicas têm propriedades inseticidas, sendo as folhas e frutos secos, usados para proteger roupas armazenada contra insetos.
CINERÁRIA (Senecio douglasii);
CIPRESTE CALIFÓRNIA ( Cupressus macrocarpa) Sob encomenda;É uma árvore ornamental conífera sempre verde de porte médio e copa ampla frondosa, quando adulta muitas vezes o topo torna forma irregular e achatado como resultado dos fortes ventos, dando a planta uma característica diferenciada.
CIPRESTE DOS HIMALAIAS (Cupressaceae);Cupressus torulosa, vulgarmente conhecido como o cipreste do Himalaia ou o cipreste do Butão, é uma espécie de cipreste nativa do sul da Ásia. É uma árvore grande, crescendo até 45 m de altura.
CIPRESTE ITALIANO  (Cupressus sempervirens);
CIPRESTE ITALIANO (Cupressus sempervirens) Sob encomenda;Se mantem verde o ano todo, é muito interessante e decorativo com seu porte e folhagem escura. O cipreste italiano é muito resistente ao fogo e pode ser usado como barreira para os incêndios que afetam a região mediterrânea.
CLOROFITO  (Chorophytum comosum);
Name;Description
CLÚSIA  (Clusia fluminensis);
COENTRO (Coriandrum sativum);
COENTRO VERDÃO ( Coriandrum sativum L.);As flores são pequenas, assimétricas e bonitas com maravilhoso aroma. Não pode faltar na horta doméstica  ainda é ornamental e suas flores e folhagem graciosas podem formar belos maciços e bordaduras. Também pode ser plantado em vasos e jardineiras. Atinge 50 cm de altura.
COENTRO VERDÃO ORGÂNICO (Coriandrum sativum);"Folhas lisas e altas, de coloração verde escura Precocidade na colheita, boa produtividade e ótima formação de mações. Boa adaptação a altas temperaturas Tolerância a nematóides M.incógnita raça 3, M.javanica e Menterolobii"
COITÉ (CUIEIRA) (Crescentia cujete);
COLAR DE PÉROLAS (Senecio rowleyanus);O Colar de Pérolas é nativo da África, e bem delicado. As folhas são semelhantes ao formato de ervilhas, com feixe mais transparente para passagem de luz. As flores crescem em formato de capítulos, com a coloração bem branca e com os estames coloridos de uma cor púrpura, extremamente forte. Floresce na primavera.
Coleção Orquideas Estações - Orquideas de Inverno;Chegou o inverno. Descubra os motivos que levam diversas orquídeas a florescerem na época em que as outras plantas estão em dormência. 35 espécies: Confira uma seleção de espécies de orquídeas que se enchem de belas flores no inverno e as dicas para acertar no cultivo. Cuidados na estação: Veja como tratar das orquídeas que floresceram no outono, das que estão floridas agora e preparar a florada de primavera.
Coleção Orquideas Estações - Orquideas de Outono;A vez do outono. Entenda como e por que os dias mais curtos e as temperaturas mais amenas influenciam nas orquídeas desta estação. As belas da estação. Uma galeria com 39 espécies, suas características e o que você precisa saber para ter sucesso no cultivo e obter belas floridas. Dicas de cultivo. O que fazer com as orquídeas recém-floridas de verão, como prolongar as flores de outono e se preparar para o inverno.
Coleção Orquideas Estações - Orquideas de Primavera;Primavera florida Descubra os fatores que levam a maior parte das orquídeas a florescer nesta época do ano. 36 orquídeas Uma seleção das espécies que dão flores na primavera e as dicas para cuidar delas corretamente. Acerte no vaso Como escolher o recipiente e o substrato ideal para ter sucesso com cada tipo de orquídea.
Coleção Orquideas Estações - Orquideas de Verão;No calor do verão. Muitas orquídeas preferem florescer na estação mais quente do ano. Entenda o porquê. 32 espécies: Conheça as orquídeas que dão flores no verão e confira as dicas para sempre acertar no cultivo. Xô, bicho! Aprenda a identificar e controlar as principais pragas e  doenças que ameaçam as suas orquídeas
Coleção Rubi Volume 1 - Orquídeas Brasileiras;O melhor de falar das orquídeas que vegetam o solo brasileiro é a enorme variedade de espécies, conforme as características dos seus biomas de origem. E entender que a Cattleya purpurata da úmida Mata Atlântica de Santa Catarina é radicalmente diferente do Cyrtopodium virescens que sobrevive até os incêndios típicos do Cerrado, informações que fazem toda diferença na hora do cultivo. Orquídeas da Natureza - Os caçadores de orquídeas: Espécies brasileiras que mudaram a história da orquidofilia mundial. Ecossistemas e espécies: Os principais biomas do Brasil e as orquídeas características de cada um. Como interpretar o hábitat: Aprenda a reproduzir a condição de luz e umidade que a orquídea encontra na natureza.
Coleção Rubi Volume 10 - Orquídeas Dendobrium;Especialista ensina : Aprenda com a colecionadora Leili Izumida os truques para ter sucesso com os Dendrobium. As mais belas espécies. Conheça todas as características de 26 orquídeas do gênero com as mais variadas formas e cores. Dicas de cultivo: Um guia com todas as informações para você fazer seu Dendrubium florescer.
Coleção Rubi Volume 2 - Orquídeas Perfumadas;Orquídeas da Natureza. Fragrâncias sedutoras: Entenda as razões biológicas e químicas que fazem a orquídea ser uma planta tão aromática. Perfume a sua casa. Descrição e dicas de cultivo de espécies com aroma de mel, canela, rosas, frutas cítricas e muito mais. Estratégias curiosas: Detalhes das artimanhas que algumas orquídeas usam para atrair os agentes polinizadores.
Coleção Rubi Volume 3 - Vanda;Entenda as Vandas: As principais características dessa orquídea que vai muito bem no Brasil e tem flores extraordinárias. Espécies e híbridos: Conheça a espécie-tipo, alguns dos milhares de híbridos e as histórias das plantas de maior sucesso. Dicas de cultivo Aprenda a criar o ambiente ideal, o cuidado com as raízes e como obter mais de uma floração por ano.
Coleção Rubi Volume 4 - Mini e Micro Orquídeas;Mini e Micro Orquídeas. Micro e miniorquídeas: Aprenda a diferença entre mini e micro-orquídeas e entenda porque elas ganham cada vez mais fãs. Comece sua coleção: Conheça e saiba como cultivar 29 espécies e tenha um curioso orquidário num pequeno espaço. Dicas de cultivo: Especialistas ensinam como cuidar das miniorquídeas e ter touceiras vistosas e floradas esplêndidas.
Coleção Rubi Volume 5 - Orquídeas Chuva-de-Ouro;Orquídeas chuva-de-ouro: Chuva de flores. Conheça espécies e híbridos da chuva-de-ouro de diferentes tamanhos, perfumes e cores. Na natureza: Especialista mostra como se comportam as Oncidiinae que vivem em diferentes hábitats. Decoração: Dicas para você valorizar a beleza da florada da chuva-de-ouro em jardins verticais, vasos e cachepôs.
Coleção Rubi Volume 6 - Orquídeas Phalaenopsis;"Phalaenopsis: Espécies. Conheça 15 phalaenopsis bem diferentes das tradicionais orquídeas-borboletas. HíbridasFloridas por até três meses, elas são as orquídeas mais comercializadas do mundo. Cultivo: Aprenda os segredos de cultivo das Phalaenopsis, para obter floradas sempre exuberantes."
Coleção Rubi Volume 7 - Orquídeas Cymbidium;"Cymbidium híbridos. Uma das cinco orquídeas mais vendidas, sua florada em cachos chega a durar até três meses.  Espécies nobres: Ainda raras no Brasil, elas têm uma beleza diferente que desperta o desejo dos colecionadores.Dicas de cultivo: O que você precisa saber para se dar bem com as regas, adubações, multiplicação e outros cuidados."
Coleção Rubi Volume 8 - Orquídeas Sapatinho ;Paphiopedilum. Com labelo gigantesco e belas flores de até 20 cm, eles se destacam em qualquer coleção. Phragmpedium: Conheça esses sapatinhos que fazem sucesso devido à descoberta recente de novas espécies.  Dicas de cultivo: Entenda todos os cuidados que elas exigem, especialmente com temperatura e umidade.
Coleção Rubi Volume 9 - Orquídeas Valquerianas ;Orquídea nativa. Conheça a walkeriana, uma espécie brasileira cheia de história que conquistou o mundo. Flores perfeitas. Desde 1970, a walkeriana é aperfeiçoada para produzir a flor ideal, sonho dos colecionadores. Dicas de cultivo Cinco especialistas ensinam os segredos para a walkeriana florescer exuberantemente.
Name;Description
COMIGO NINGUÉM PODE (Dieffenbachia amoena);
COPAÍBA (Copaifera langsdorffii);De sombra generosa e medicinal, essa árvore é excelente para ruas e praças. A Copaíba é considerada o antinflamatório da floresta, devido aos seus atributos de cura e melhorias na saúde humana.
COPAÍBA (Copaifera langsdorffii);
COPO DE LEITE (Zantedeschia aethiopica);
COPPERTONE STONECROP (Sedum nussbaumerianum) ;A Coopertone vem do México com suas folhas amarelo-esverdeadas ou vermelho-acobreadas, arredondadas e pontudas. As flores são pequenas, brancas, em forma de estrela e perfumadas.
CORAÇÃO DE NEGRO ( Caesalpinia pluviosa);Nativa da Mata Atlântica, o Coração-de-Negro, que também é regionalmente conhecido como ipê coração ou canela do brejo, pode atingir 25 metros de altura. Além do valor comercial que faz com que sua preservação seja almejada, o coração-de-negro é largamente plantado em áreas degradadas para recuperação, como florestas desmatadas ou matas ciliares.
COSMOS DE JARDIM COSMEA SENSAÇÃO (Cosmos bipinnatus);"Sementes de Cosmos, da variedade ""Sensação"", nas cores branca, rosa e vermelha. Uma planta herbácea, anual, de flores vistosas e fácil de cultivar. Apresenta porte arbustivo e ramagem ramificada. Suas folhas são opostas, finamente divididas em segmentos lineares e filiformes, que dão um aspecto plumoso à folhagem. A inflorescência é simples nesta variedade, e é do tipo capítulo. As pétalas podem ser róseas, brancas ou vermelhas."
COUVE BRÓCOLI PIRACICABA PRECOCE (Brassica oleracea.);Sementes de Brócolis Brassica oleracea var. italica da variedade Piracicaba Precoce. Muito saboroso e nutritivo.
COUVE BROCOLIS ROMANTESCO ( Brassica oleracea.);O romanesco é a inflorescência comestível da Brassica oleracea var. botrytis, uma variedade da espécie a que pertencem também a couve-flor, o brócolis, a couve, o repolho e a couve-de-bruxelas. É originário da Itália e mais precisamente de Roma.
COUVE CHINESA PETSAI (Brassica oleracea.);Repolho-china, repolho-chinês, bok choy ou chingensai é um complexo de variedades de repolho cultivadas e largamente usadas na culinária oriental.
COUVE DE BRUXELAS (Brassica oleracea.);Couve-de-bruxelas é uma verdura que lembra pequenos repolhos e por isso, também é chamada de repolhinho, é do mesmo género que a couve. Ela tem a particularidade de crescer ao longo do talo da planta, que na época da colheita fica totalmente coberto pelos pequenos repolhos.
COUVE MANTEIGA DA GEORGIA (Brassica oleracea.);A semente de Couve é uma verdura fácil de plantar e com baixo custo. Para aqueles que não abrem mão de uma boa salada ou até mesmo para fazer sucos desintoxicantes, ter uma produção caseira de couve é uma ótima opção.
CRAVO DA ÍNDIA (Eugenia caryophyllata) ;
CRISANTEMO CARINATUM SORTIDO ( Chrysanthemum.);O Crisântemo é um planta que é cultivada a milhares de anos nos países asiáticos. Em grego, crisântemo significa “flor de ouro”. Existe mais de 100 espécies de crisântemo e mais de 800 variedades pelo mundo. Seu tamanho médio é de 1 metro e suas propagação é feita atrás por estaca e sementes, dando flores o ano todo. Para seu desenvolvimento é necessário muita luz indireta e, de preferência um clima quente e úmido.
CRÓTON AMARELO (Codiaeum variegatum);Muito parecido com o Cróton de folhas Vermelhas, o Crotón Amarelo é ornamental  e atinge de 2 a 3 metros, possui folhas amarelas e é interessante para cerca viva e paisagismo. Gosta de calor.
CRÓTON VERMELHO (Codiaeum variegatum);
CUPUAÇÚ (Theobroma grandiflorum);
CURRY (Murraya koenigii);
CUSPIDARIA (Cuspidaria convoluta);
DAMA DA NOITE (Cestrum nocturnum);
Name;Description
DEDALEIRO OU MANGABA BRAVA ( Lafoensia pacari.);Por seu porte pequeno, raízes não agressivas e florescimento ornamental, o Dedaleiro é bastante utilizado na arborização urbana de diversos municípios do Paraná. Seu plantio também é recomendado na recuperação de áreas degradadas e na recomposição de mata ciliar. Por não ser uma espécie pioneira, é interessante efetuar plantios mistos ou em anos subsequentes ao início do reflorestamento.
DEDO DE MOÇA (Sedum pachyphyllum) ;A Dedo de Moça é uma suculenta da família das Crassuláceas com folhas curtas, verde claras e prateadas. As flores amarelas aparecem no Verão.
DILL (Anethum graveolens);
DINHEIRO EM PENCA (Pilea nummulariifolia);
DORMIDEIRA  (Mimosa pudica) Sob encomenda;Mimosa pudica L., conhecida popularmente por dormideira, sensitiva, dorme-dorme ou não-me-toques é um pequeno arbusto perene da América tropical, pertencente à família das ervilhas. Este nome é devido à forma como os folíolos das folhas se juntam quando ela é tocada ou exposta ao calor.
DRACENA ARBOREA (Dracena arbórea);
DRACENA PLEOMELE (Dracaena reflexa);
DRACENA TRICOLOR (Dracena marginata);
EMBAUBA  (Cecropia hololeuca);A árvore é uma das mais belas de nossa flora, muito apreciada pelos animais e insetos.
EMBAÚBA (Cecropia hololeuca);
EMBAÚBA PRATA (Cecropia hololeuca);Quanto à qualidade de sua madeira, é macia e de baixa resistência. Ou seja, pode ser usada na confecção de objetos leves, como fósforos, caixotaria, lápis, brinquedos, aeromodelismo, tamancos e saltos de calçados. Mas bom mesmo é a qualidade de seus frutos, alegria da fauna onde há sua ocorrência.
